{
  "meta": {
    "name": "Moonlit Editorial",
    "description": "Tema editorial premium com contraste refinado, atmosfera elegante e presença visual mais marcante"
  },
  "colors": {
    "background": "#F6F1EA",
    "surface": "#f8edde",
    "surfaceSoft": "rgba(36,28,24,0.028)",
    "primary": "#8E6C57",
    "primarySoft": "#B69A87",
    "text": "#221A17",
    "textMuted": "rgba(34,26,23,0.62)",
    "textSoft": "rgba(34,26,23,0.68)",
    "textDim": "rgba(34,26,23,0.46)",
    "textFaint": "rgba(34,26,23,0.24)",
    "textPlaceholder": "rgba(34,26,23,0.34)",
    "border": "rgba(142,108,87,0.24)",
    "borderSoft": "rgba(142,108,87,0.14)",
    "borderStrong": "rgba(142,108,87,0.40)",
    "goldSurfaceSoft": "rgba(142,108,87,0.05)",
    "goldSurface": "rgba(142,108,87,0.09)",
    "goldSurfaceStrong": "rgba(142,108,87,0.16)",
    "primaryGlow": "rgba(142,108,87,0.12)",
    "pageGridLine": "rgba(34,26,23,0.04)",
    "overlayBackdrop": "rgba(28,22,19,0.74)",
    "audioPanelBg": "rgba(255,252,248,0.92)",
    "audioPanelHoverBg": "rgba(255,252,248,0.98)",
    "audioPanelBorder": "rgba(142,108,87,0.28)",
    "pulseRing": "rgba(142,108,87,0.42)",
    "pulseRingSpread": "rgba(142,108,87,0)",
    "inputFocusBg": "rgba(142,108,87,0.06)"
  },
  "typography": {
    "roles": {
      "heroTitle": {
        "family": "imperial_script",
        "size": {
          "min": "58px",
          "fluid": "11.5vw",
          "max": "116px"
        },
        "weight": 400,
        "lineHeight": 1.02,
        "style": "normal"
      },
      "heroSubtitle": {
        "family": "jost",
        "size": "11px",
        "weight": 400,
        "lineHeight": 1.5,
        "letterSpacing": "0.12em",
        "textTransform": "uppercase",
        "style": "normal"
      },
      "eyebrow": {
        "family": "jost",
        "size": "10px",
        "weight": 500,
        "textTransform": "uppercase",
        "letterSpacing": "0.14em",
        "lineHeight": 1.2,
        "style": "normal"
      },
      "sectionTitle": {
        "family": "playfair_display",
        "size": {
          "min": "36px",
          "fluid": "6.8vw",
          "max": "60px"
        },
        "weight": 500,
        "lineHeight": 1.14,
        "style": "normal"
      },
      "sectionSubtitle": {
        "family": "jost",
        "size": "13px",
        "weight": 300,
        "lineHeight": 1.7,
        "style": "normal"
      },
      "body": {
        "family": "jost",
        "size": "13px",
        "weight": 300,
        "lineHeight": 1.72,
        "style": "normal"
      },
      "formLabel": {
        "family": "jost",
        "size": "12px",
        "weight": 400,
        "lineHeight": 1.45,
        "style": "normal"
      },
      "button": {
        "family": "jost",
        "size": "10px",
        "weight": 500,
        "letterSpacing": "0.08em",
        "textTransform": "uppercase",
        "lineHeight": 1.2,
        "style": "normal"
      },
      "countdownNumber": {
        "family": "playfair_display",
        "size": "44px",
        "weight": 500,
        "lineHeight": 1,
        "style": "normal"
      },
      "footer": {
        "family": "bj_cree",
        "size": "34px",
        "weight": 400,
        "lineHeight": 1.25,
        "style": "normal"
      }
    },
    "fonts": {
      "primary": "'Jost', sans-serif",
      "serif": "'Playfair Display', serif",
      "accent": "'Imperial Script', cursive"
    },
    "sizes": {
      "base": "13px",
      "heroLabel": "10px",
      "heroDate": "11px",
      "heroNames": {
        "min": "58px",
        "fluid": "11.5vw",
        "max": "116px"
      },
      "scrollHint": "9px",
      "sectionTag": "10px",
      "sectionTitle": {
        "min": "36px",
        "fluid": "6.8vw",
        "max": "60px"
      },
      "sectionBody": "13px",
      "countdownNumber": "44px",
      "countdownLabel": "8px",
      "countdownFinished": "30px",
      "detailIcon": "18px",
      "detailTitle": "8px",
      "detailValue": "20px",
      "detailSub": "10px",
      "rsvpTitle": "40px",
      "rsvpSubtitle": "11px",
      "rsvpInput": "12px",
      "rsvpChoice": "10px",
      "rsvpSubmit": "10px",
      "rsvpSuccessText": "26px",
      "rsvpSuccessSub": "11px",
      "footerNames": "34px",
      "footerNote": "10px"
    }
  },
  "spacing": {
    "containerWidth": "780px",
    "cardPadding": "30px",
    "sectionPaddingTop": "96px",
    "sectionPaddingInline": "26px",
    "detailsSectionPaddingTop": "96px",
    "sectionTagGap": "32px",
    "sectionTitleGap": "24px",
    "heroLabelGap": "18px",
    "heroDateGap": "22px",
    "scrollHintBottom": "24px",
    "scrollHintGap": "8px",
    "dividerMarginTop": "60px",
    "countdownMarginTop": "42px",
    "countdownGap": "14px",
    "detailsMarginTop": "42px",
    "detailsGridGap": "1px",
    "detailCardPaddingBlock": "30px",
    "detailCardPaddingInline": "22px",
    "rsvpShellPaddingBottom": "96px",
    "rsvpCardMarginTop": "42px",
    "rsvpCardPaddingBlock": "52px",
    "rsvpCardPaddingInline": "34px",
    "rsvpSubtitleGap": "34px",
    "rsvpFormGap": "14px",
    "rsvpChoiceGap": "10px",
    "rsvpSubmitMarginTop": "10px",
    "footerPaddingBottom": "52px"
  },
  "layout": {
    "heroHeight": "100vh",
    "heroPadding": "0 26px 68px",
    "heroContentWidth": "760px",
    "heroContentPaddingBottom": "40px",
    "heroFadeOffset": "48px",
    "contentMaxWidth": "780px"
  },
  "components": {
    "dividerWidth": "340px",
    "dividerDiamond": "6px",
    "scrollArrowWidth": "14px",
    "scrollArrowHeight": "48px",
    "scrollArrowStemHeight": "36px",
    "scrollArrowHeadSize": "8px",
    "countdownCardPaddingTop": "24px",
    "countdownCardPaddingInline": "10px",
    "countdownCardPaddingBottom": "18px",
    "rsvpInputPaddingBlock": "15px",
    "rsvpInputPaddingInline": "18px",
    "rsvpChoiceMinHeight": "50px",
    "rsvpChoicePadding": "12px",
    "rsvpSubmitPaddingBlock": "16px",
    "rsvpSubmitPaddingInline": "34px",
    "rsvpSuccessIcon": "32px"
  },
  "radius": {
    "card": "4px",
    "button": "2px"
  },
  "effects": {
    "shadowSoft": "0 20px 56px rgba(34,26,23,0.10)",
    "shadowHover": "0 10px 28px rgba(34,26,23,0.08)",
    "textShadowStrong": "0 10px 26px rgba(246,241,234,0.58)",
    "textShadowSoft": "0 3px 12px rgba(246,241,234,0.42)",
    "focusRing": "0 0 0 3px rgba(142,108,87,0.15)",
    "transition": "all 0.3s ease",
    "pageGradient": "linear-gradient(180deg, #F6F1EA 0%, #F2ECE4 100%)",
    "introBackdropGradient": "linear-gradient(180deg, rgba(246,241,234,0.97) 0%, rgba(255,252,248,0.98) 42%, rgba(242,236,228,0.99) 100%)",
    "introCardGradient": "linear-gradient(180deg, rgba(255,255,255,0.62), rgba(142,108,87,0.05))",
    "buttonFillGradient": "linear-gradient(135deg, rgba(142,108,87,0.95), rgba(182,154,135,0.92))",
    "heroOverlayGradient": "linear-gradient(to bottom, rgba(246,241,234,0.05) 0%, rgba(246,241,234,0.12) 38%, rgba(246,241,234,0.80) 76%, rgba(246,241,234,1) 100%)",
    "overlayPanelGradient": "linear-gradient(180deg, rgba(255,252,248,0.98) 0%, rgba(246,241,234,0.99) 100%)",
    "overlayCloseGradient": "linear-gradient(180deg, rgba(255,252,248,0.95), rgba(255,252,248,0))",
    "rsvpPanelGradient": "linear-gradient(135deg, rgba(142,108,87,0.06), rgba(142,108,87,0.018))",
    "giftPanelGradient": "linear-gradient(135deg, rgba(142,108,87,0.06), rgba(255,255,255,0.04))"
  },
  "animation": {
    "fadeDuration": "0.9s",
    "staggerDelay": "0.12s",
    "heroFadeDuration": "1.6s",
    "heroRevealDelayMs": 320
  },
  "countdown": {
    "format": "two-digits",
    "updateInterval": 1000
  },
  "responsive": {
    "mobile": {
      "typography": {
        "sizes": {
          "base": "12px",
          "heroDate": "13px",
          "heroNames": {
            "min": "28px",
            "fluid": "10.5vw",
            "max": "52px"
          }
        }
      },
      "spacing": {
        "sectionPaddingTop": "44px",
        "sectionPaddingInline": "20px",
        "detailsSectionPaddingTop": "44px"
      },
      "layout": {
        "heroHeight": "700px",
        "heroPadding": "0 20px 74px",
        "heroContentWidth": "340px",
        "heroContentPaddingBottom": "34px",
        "heroFadeOffset": "22px",
        "contentMaxWidth": "620px"
      },
      "animation": {
        "heroFadeDuration": "2.2s",
        "heroRevealDelayMs": 1200
      }
    }
  }
}